[
  {
    "id": "cv",
    "title": "Curriculum Vitae",
    "type": "cv",
    "file_url": "/documents/thanh-vu-cv.pdf",
    "description": "Education, experience, and skills. Replace the PDF in public/documents/.",
    "sort_order": 1,
    "is_published": true
  },
  {
    "id": "cover-letter",
    "title": "Cover Letter",
    "type": "cover_letter",
    "file_url": "/documents/thanh-vu-cover-letter.pdf",
    "description": "A tailored introduction for the roles you are applying to.",
    "sort_order": 2,
    "is_published": true
  },
  {
    "id": "linkedin-profile",
    "title": "LinkedIn Profile",
    "type": "other",
    "file_url": "/documents/thanh-vu-references.pdf",
    "description": "A printable snapshot of your LinkedIn profile and its revision history.",
    "sort_order": 3,
    "is_published": true
  }
]
